<?xml version="1.0" encoding="UTF-8"?>
<specification id="Confidentiality_new" xmlns:xsi="http://www.w3.org/2001/XMLSchema-instance" xsi:noNamespaceSchemaLocation="xsd_aniketos.xsd"><maxint>32000</maxint><maxlen>1000</maxlen><scope>session</scope><securitystate><declaration><type>string</type><identifier>Service</identifier><value><sconst>Send_Document</sconst></value></declaration><declaration><type>string</type><identifier>inputSuite</identifier><value><sconst>Basic256Sha256Rsa15</sconst></value></declaration><declaration><type>string</type><identifier>inputSchema</identifier><value><sconst>symmetric</sconst></value></declaration><declaration><type>string</type><identifier>inputAlgorithm</identifier><value><sconst>AES</sconst></value></declaration><declaration><type>int</type><identifier>inputKeyLength</identifier><value><iconst>256</iconst></value></declaration><declaration><type>string</type><identifier>outputSuite</identifier><value><sconst>Basic256Sha256Rsa15</sconst></value></declaration><declaration><type>string</type><identifier>outputSchema</identifier><value><sconst>symmetric</sconst></value></declaration><declaration><type>string</type><identifier>outputAlgorithm</identifier><value><sconst>AES</sconst></value></declaration><declaration><type>int</type><identifier>outputKeyLength</identifier><value><iconst>256</iconst></value></declaration></securitystate><rule><before><identifier>activity.end</identifier><parameter><type>string</type><identifier>id</identifier></parameter><parameter><type>string</type><identifier>type</identifier></parameter><parameter><type>int</type><identifier>time</identifier></parameter><parameter><type>int</type><identifier>date</identifier></parameter><parameter><type>string</type><identifier>exec</identifier></parameter><parameter><type>string</type><identifier>Output</identifier></parameter></before><perform><reaction><guard><and><s_equal><s_identifier>id</s_identifier><s_identifier>Service</s_identifier></s_equal><invocation><b_identifier>java.prova.ConfidentialityCheck</b_identifier><b_identifier>result</b_identifier><argument><s_identifier>Service</s_identifier></argument><argument><s_identifier>inputSuite</s_identifier></argument><argument><s_identifier>inputSchema</s_identifier></argument><argument><s_identifier>inputAlgorithm</s_identifier></argument><argument><i_identifier>inputKeyLength</i_identifier></argument><argument><s_identifier>outputSuite</s_identifier></argument><argument><s_identifier>outputSchema</s_identifier></argument><argument><s_identifier>outputAlgorithm</s_identifier></argument><argument><i_identifier>outputKeyLength</i_identifier></argument></invocation></and></guard><update /></reaction></perform></rule></specification>
